{
  "anti_scope_ast": {
    "op": "constant",
    "value": false
  },
  "candidate_id": "P6-SCOPE-EXPAND-C",
  "candidate_name": "blind-scope-control-scope_expand",
  "certification_control": "anti_scope_leak",
  "counterfactual_contract": {
    "causal_interventions": [
      "protected_signal_inversion"
    ],
    "minimum_causal_delta": 0.2,
    "nuisance_interventions": [
      "nuisance_marker_permutation"
    ],
    "nuisance_tolerance": 1e-09
  },
  "evidence_contract": {
    "availability": "declared_per_case",
    "failure_behavior": "deactivate",
    "freshness_seconds": 60.0,
    "minimum_trust": 0.6,
    "provenance": "audited_visible_evidence_registry",
    "sources": [
      "context_match",
      "independence_score",
      "provenance_strength",
      "risk_score"
    ]
  },
  "expression_ast": {
    "children": [
      {
        "children": [
          {
            "left": {
              "name": "risk_score",
              "op": "feature"
            },
            "op": "gte",
            "right": {
              "name": "threshold",
              "op": "parameter"
            }
          },
          {
            "children": [
              {
                "left": {
                  "name": "independence_score",
                  "op": "feature"
                },
                "op": "gte",
                "right": {
                  "name": "safe_ceiling",
                  "op": "parameter"
                }
              },
              {
                "left": {
                  "name": "context_match",
                  "op": "feature"
                },
                "op": "gte",
                "right": {
                  "name": "scope_lower",
                  "op": "parameter"
                }
              }
            ],
            "op": "or"
          }
        ],
        "op": "and"
      },
      {
        "left": {
          "name": "provenance_strength",
          "op": "feature"
        },
        "op": "gte",
        "right": {
          "name": "trust_floor",
          "op": "parameter"
        }
      }
    ],
    "op": "and"
  },
  "influence_contract": {
    "channel": "terminal",
    "maximum": 1.0,
    "minimum": 0.0,
    "terminal_authority": true
  },
  "integrity_control": null,
  "lineage": {
    "operation": "scope_expand",
    "parameter_trace": "parameter_search.parquet",
    "parents": [
      "phase3-parent-scope_expand"
    ],
    "rollback_target": "phase3-parent-scope_expand",
    "structure_trace": "structure_search.parquet",
    "synthesis_evidence": [
      "synthesis",
      "development"
    ],
    "triggering_contrast": "protected-scope_expand-contrast"
  },
  "operation_payload": {
    "new_region_case_ids": [
      "positive_scope_boundary-0032"
    ],
    "parent_positive_scope_ast": {
      "left": {
        "name": "context_match",
        "op": "feature"
      },
      "op": "gte",
      "right": {
        "op": "constant",
        "value": 0.5
      }
    },
    "passed_suites": [
      "boundary",
      "anti_scope",
      "holdout",
      "disjoint_analogue"
    ]
  },
  "parameters": {
    "anti_scope_upper": 0.1,
    "availability_floor": 0.5,
    "interaction": 0.5,
    "masking_floor": 0.5,
    "persistence_floor": 0.5,
    "safe_ceiling": 0.5,
    "scope_lower": 0.25,
    "scope_upper": 0.75,
    "threshold": 0.3,
    "trust_floor": 0.17,
    "weight": 1.0
  },
  "positive_scope_ast": {
    "op": "constant",
    "value": true
  },
  "schema_version": "1.0.0"
}
