{
  "anti_scope_ast": {
    "left": {
      "name": "context_match",
      "op": "feature"
    },
    "op": "lte",
    "right": {
      "name": "anti_scope_upper",
      "op": "parameter"
    }
  },
  "candidate_id": "P6-EVIDENCE-RECOVERY-I",
  "candidate_name": "renamed-evidence_recovery-control",
  "certification_control": null,
  "counterfactual_contract": {
    "causal_interventions": [
      "protected_signal_inversion"
    ],
    "minimum_causal_delta": 0.2,
    "nuisance_interventions": [
      "nuisance_marker_permutation"
    ],
    "nuisance_tolerance": 1e-09
  },
  "evidence_contract": {
    "availability": "declared_per_case",
    "failure_behavior": "deactivate",
    "freshness_seconds": 60.0,
    "minimum_trust": 0.6,
    "provenance": "audited_visible_evidence_registry",
    "sources": [
      "context_match",
      "evidence_available",
      "query_signal",
      "risk_score"
    ]
  },
  "expression_ast": {
    "children": [
      {
        "left": {
          "name": "risk_score",
          "op": "feature"
        },
        "op": "gte",
        "right": {
          "name": "threshold",
          "op": "parameter"
        }
      },
      {
        "children": [
          {
            "left": {
              "name": "query_signal",
              "op": "feature"
            },
            "op": "gte",
            "right": {
              "name": "safe_ceiling",
              "op": "parameter"
            }
          },
          {
            "left": {
              "name": "evidence_available",
              "op": "feature"
            },
            "op": "gte",
            "right": {
              "name": "availability_floor",
              "op": "parameter"
            }
          }
        ],
        "op": "or"
      }
    ],
    "op": "and"
  },
  "influence_contract": {
    "channel": "terminal",
    "maximum": 1.0,
    "minimum": 0.0,
    "terminal_authority": true
  },
  "integrity_control": "name_only_semantic_duplicate",
  "lineage": {
    "operation": "evidence_recovery",
    "parameter_trace": "parameter_search.parquet",
    "parents": [
      "phase3-parent-evidence_recovery"
    ],
    "rollback_target": "phase3-parent-evidence_recovery",
    "structure_trace": "structure_search.parquet",
    "synthesis_evidence": [
      "synthesis",
      "development"
    ],
    "triggering_contrast": "protected-evidence_recovery-contrast"
  },
  "operation_payload": {
    "acquisition_record": {
      "availability": "declared_per_case",
      "consumed_feature": "query_signal",
      "cost": 1.0,
      "provenance": "audited_query",
      "realized_information_gain": 0.5,
      "status": "executed"
    }
  },
  "parameters": {
    "anti_scope_upper": 0.1,
    "availability_floor": 0.5,
    "interaction": 0.5,
    "masking_floor": 0.5,
    "persistence_floor": 0.5,
    "safe_ceiling": 0.5,
    "scope_lower": 0.25,
    "scope_upper": 0.75,
    "threshold": 0.35,
    "trust_floor": 0.5,
    "weight": 0.8
  },
  "positive_scope_ast": {
    "left": {
      "name": "context_match",
      "op": "feature"
    },
    "op": "gte",
    "right": {
      "name": "scope_lower",
      "op": "parameter"
    }
  },
  "schema_version": "1.0.0"
}
