{
  "anti_scope_ast": {
    "left": {
      "name": "context_match",
      "op": "feature"
    },
    "op": "lte",
    "right": {
      "name": "anti_scope_upper",
      "op": "parameter"
    }
  },
  "candidate_id": "P6-ADD-B",
  "candidate_name": "documentary-add-b",
  "certification_control": null,
  "counterfactual_contract": {
    "causal_interventions": [
      "protected_signal_inversion"
    ],
    "minimum_causal_delta": 0.2,
    "nuisance_interventions": [
      "nuisance_marker_permutation"
    ],
    "nuisance_tolerance": 1e-09
  },
  "evidence_contract": {
    "availability": "declared_per_case",
    "failure_behavior": "deactivate",
    "freshness_seconds": 60.0,
    "minimum_trust": 0.6,
    "provenance": "audited_visible_evidence_registry",
    "sources": [
      "context_match",
      "independence_score",
      "provenance_strength",
      "query_signal"
    ]
  },
  "expression_ast": {
    "children": [
      {
        "children": [
          {
            "left": {
              "name": "query_signal",
              "op": "feature"
            },
            "op": "gte",
            "right": {
              "name": "threshold",
              "op": "parameter"
            }
          },
          {
            "left": {
              "name": "provenance_strength",
              "op": "feature"
            },
            "op": "gte",
            "right": {
              "name": "trust_floor",
              "op": "parameter"
            }
          }
        ],
        "op": "and"
      },
      {
        "left": {
          "name": "independence_score",
          "op": "feature"
        },
        "op": "gte",
        "right": {
          "name": "trust_floor",
          "op": "parameter"
        }
      }
    ],
    "op": "and"
  },
  "influence_contract": {
    "channel": "terminal",
    "maximum": 1.0,
    "minimum": 0.0,
    "terminal_authority": true
  },
  "integrity_control": null,
  "lineage": {
    "operation": "add",
    "parameter_trace": "parameter_search.parquet",
    "parents": [
      "phase3-parent-add"
    ],
    "rollback_target": "phase3-parent-add",
    "structure_trace": "structure_search.parquet",
    "synthesis_evidence": [
      "synthesis",
      "development"
    ],
    "triggering_contrast": "protected-add-contrast"
  },
  "operation_payload": {
    "new_dependency": true,
    "new_extension_witness": true
  },
  "parameters": {
    "anti_scope_upper": 0.15,
    "availability_floor": 0.5,
    "interaction": 0.5,
    "masking_floor": 0.5,
    "persistence_floor": 0.5,
    "safe_ceiling": 0.5,
    "scope_lower": 0.15,
    "scope_upper": 0.75,
    "threshold": 0.35,
    "trust_floor": 0.17,
    "weight": 0.9
  },
  "positive_scope_ast": {
    "left": {
      "name": "context_match",
      "op": "feature"
    },
    "op": "gte",
    "right": {
      "name": "scope_lower",
      "op": "parameter"
    }
  },
  "schema_version": "1.0.0"
}
