{
  "anti_scope_ast": {
    "left": {
      "name": "context_match",
      "op": "feature"
    },
    "op": "lte",
    "right": {
      "name": "anti_scope_upper",
      "op": "parameter"
    }
  },
  "candidate_id": "P6-POLICY-INTERACTION-I",
  "candidate_name": "renamed-policy_interaction-control",
  "certification_control": null,
  "counterfactual_contract": {
    "causal_interventions": [
      "protected_signal_inversion"
    ],
    "minimum_causal_delta": 0.2,
    "nuisance_interventions": [
      "nuisance_marker_permutation"
    ],
    "nuisance_tolerance": 1e-09
  },
  "evidence_contract": {
    "availability": "declared_per_case",
    "failure_behavior": "deactivate",
    "freshness_seconds": 60.0,
    "minimum_trust": 0.6,
    "provenance": "audited_visible_evidence_registry",
    "sources": [
      "context_match",
      "policy_conflict",
      "risk_score"
    ]
  },
  "expression_ast": {
    "left": {
      "children": [
        {
          "name": "policy_conflict",
          "op": "feature"
        },
        {
          "children": [
            {
              "name": "risk_score",
              "op": "feature"
            },
            {
              "name": "interaction",
              "op": "parameter"
            }
          ],
          "op": "mul"
        }
      ],
      "op": "max"
    },
    "op": "gte",
    "right": {
      "name": "threshold",
      "op": "parameter"
    }
  },
  "influence_contract": {
    "channel": "terminal",
    "maximum": 1.0,
    "minimum": 0.0,
    "terminal_authority": true
  },
  "integrity_control": "name_only_semantic_duplicate",
  "lineage": {
    "operation": "policy_interaction",
    "parameter_trace": "parameter_search.parquet",
    "parents": [
      "phase3-parent-policy_interaction"
    ],
    "rollback_target": "phase3-parent-policy_interaction",
    "structure_trace": "structure_search.parquet",
    "synthesis_evidence": [
      "synthesis",
      "development"
    ],
    "triggering_contrast": "protected-policy_interaction-contrast"
  },
  "operation_payload": {
    "after_relationship": {
      "authority": "terminal",
      "type": "policy_conflict"
    },
    "before_relationship": {
      "authority": "observation",
      "type": "policy_evidence"
    },
    "counterfactual_obligation": "policy_conflict_inversion"
  },
  "parameters": {
    "anti_scope_upper": 0.1,
    "availability_floor": 0.5,
    "interaction": 0.5,
    "masking_floor": 0.5,
    "persistence_floor": 0.5,
    "safe_ceiling": 0.5,
    "scope_lower": 0.25,
    "scope_upper": 0.75,
    "threshold": 0.35,
    "trust_floor": 0.5,
    "weight": 0.8
  },
  "positive_scope_ast": {
    "left": {
      "name": "context_match",
      "op": "feature"
    },
    "op": "gte",
    "right": {
      "name": "scope_lower",
      "op": "parameter"
    }
  },
  "schema_version": "1.0.0"
}
